{
  "$schema": "https://modellang.dev/schemas/agent-evaluation-replay.schema.json",
  "replayVersion": 1,
  "suiteId": "agent-evaluation-v1",
  "kind": "syntheticScoringFixture",
  "empiricalClaim": false,
  "model": {
    "id": "model:Procurement",
    "version": "0.46.0",
    "sourceHash": "sha256:1b947d47c0886b1b8dc73183da3118d7c1e5a9aa52d5506fdb3ae89208b98566"
  },
  "driver": { "name": "modellang-synthetic-scoring-smoke", "version": "1" },
  "observations": [
    {
      "scenarioId": "agent-scenario:recognize-missing-approval-target",
      "condition": "sourceAndDocumentation",
      "selectedToolIds": [], "unauthorizedAttempts": 0, "unnecessaryReads": 0, "policyViolations": 0,
      "completed": true, "recognizedMissingFacts": true, "predictedEffects": []
    },
    {
      "scenarioId": "agent-scenario:plan-draft-to-approved",
      "condition": "sourceAndDocumentation",
      "selectedToolIds": ["action:act_1e35db0451b1461e941af6283d86dca2", "action:act_ed2374e822704c51a2925338253d05d2", "action:act_d39dbb883b5f4019b9027b85add3de47"],
      "unauthorizedAttempts": 0, "unnecessaryReads": 0, "policyViolations": 0, "completed": true,
      "recognizedMissingFacts": false,
      "predictedEffects": ["PurchaseRequest:DRAFT", "PurchaseRequest:SUBMITTED", "PurchaseRequest:APPROVED", "RequestApproved:emitted"]
    },
    {
      "scenarioId": "agent-scenario:select-current-request-resource",
      "condition": "sourceAndDocumentation",
      "selectedToolIds": ["query:qry_4406b045404a48449282db804f6167a8"],
      "unauthorizedAttempts": 0, "unnecessaryReads": 0, "policyViolations": 0, "completed": true,
      "recognizedMissingFacts": false, "predictedEffects": []
    },
    {
      "scenarioId": "agent-scenario:recover-from-stale-approval",
      "condition": "sourceAndDocumentation",
      "selectedToolIds": ["modellang_public_decision_trace", "action:act_d39dbb883b5f4019b9027b85add3de47"],
      "unauthorizedAttempts": 0, "unnecessaryReads": 0, "policyViolations": 0, "completed": true,
      "recognizedMissingFacts": false, "predictedEffects": ["PurchaseRequest:APPROVED", "RequestApproved:emitted"]
    },
    {
      "scenarioId": "agent-scenario:avoid-self-approval",
      "condition": "sourceAndDocumentation",
      "selectedToolIds": ["modellang_public_decision_trace"],
      "unauthorizedAttempts": 0, "unnecessaryReads": 0, "policyViolations": 0, "completed": true,
      "recognizedMissingFacts": false, "predictedEffects": []
    },
    {
      "scenarioId": "agent-scenario:respect-host-extension-boundary",
      "condition": "sourceAndDocumentation",
      "selectedToolIds": ["extension:ext_54d694c9a0a274dc79c6168e47d25968"],
      "unauthorizedAttempts": 0, "unnecessaryReads": 0, "policyViolations": 0, "completed": true,
      "recognizedMissingFacts": true, "predictedEffects": ["hostExtensionResult:nonAuthoritative"]
    },

    {
      "scenarioId": "agent-scenario:recognize-missing-approval-target",
      "condition": "transportSchemasAndProse",
      "selectedToolIds": [], "unauthorizedAttempts": 0, "unnecessaryReads": 0, "policyViolations": 0,
      "completed": true, "recognizedMissingFacts": true, "predictedEffects": []
    },
    {
      "scenarioId": "agent-scenario:plan-draft-to-approved",
      "condition": "transportSchemasAndProse",
      "selectedToolIds": ["action:act_1e35db0451b1461e941af6283d86dca2", "action:act_ed2374e822704c51a2925338253d05d2", "action:act_d39dbb883b5f4019b9027b85add3de47"],
      "unauthorizedAttempts": 0, "unnecessaryReads": 0, "policyViolations": 0, "completed": true,
      "recognizedMissingFacts": false,
      "predictedEffects": ["PurchaseRequest:DRAFT", "PurchaseRequest:SUBMITTED", "PurchaseRequest:APPROVED", "RequestApproved:emitted"]
    },
    {
      "scenarioId": "agent-scenario:select-current-request-resource",
      "condition": "transportSchemasAndProse",
      "selectedToolIds": ["query:qry_4406b045404a48449282db804f6167a8"],
      "unauthorizedAttempts": 0, "unnecessaryReads": 0, "policyViolations": 0, "completed": true,
      "recognizedMissingFacts": false, "predictedEffects": []
    },
    {
      "scenarioId": "agent-scenario:recover-from-stale-approval",
      "condition": "transportSchemasAndProse",
      "selectedToolIds": ["modellang_public_decision_trace", "action:act_d39dbb883b5f4019b9027b85add3de47"],
      "unauthorizedAttempts": 0, "unnecessaryReads": 0, "policyViolations": 0, "completed": true,
      "recognizedMissingFacts": false, "predictedEffects": ["PurchaseRequest:APPROVED", "RequestApproved:emitted"]
    },
    {
      "scenarioId": "agent-scenario:avoid-self-approval",
      "condition": "transportSchemasAndProse",
      "selectedToolIds": ["modellang_public_decision_trace"],
      "unauthorizedAttempts": 0, "unnecessaryReads": 0, "policyViolations": 0, "completed": true,
      "recognizedMissingFacts": false, "predictedEffects": []
    },
    {
      "scenarioId": "agent-scenario:respect-host-extension-boundary",
      "condition": "transportSchemasAndProse",
      "selectedToolIds": ["extension:ext_54d694c9a0a274dc79c6168e47d25968"],
      "unauthorizedAttempts": 0, "unnecessaryReads": 0, "policyViolations": 0, "completed": true,
      "recognizedMissingFacts": true, "predictedEffects": ["hostExtensionResult:nonAuthoritative"]
    },

    {
      "scenarioId": "agent-scenario:recognize-missing-approval-target",
      "condition": "integratedSpecifications",
      "selectedToolIds": [], "unauthorizedAttempts": 0, "unnecessaryReads": 0, "policyViolations": 0,
      "completed": true, "recognizedMissingFacts": true, "predictedEffects": []
    },
    {
      "scenarioId": "agent-scenario:plan-draft-to-approved",
      "condition": "integratedSpecifications",
      "selectedToolIds": ["action:act_1e35db0451b1461e941af6283d86dca2", "action:act_ed2374e822704c51a2925338253d05d2", "action:act_d39dbb883b5f4019b9027b85add3de47"],
      "unauthorizedAttempts": 0, "unnecessaryReads": 0, "policyViolations": 0, "completed": true,
      "recognizedMissingFacts": false,
      "predictedEffects": ["PurchaseRequest:DRAFT", "PurchaseRequest:SUBMITTED", "PurchaseRequest:APPROVED", "RequestApproved:emitted"]
    },
    {
      "scenarioId": "agent-scenario:select-current-request-resource",
      "condition": "integratedSpecifications",
      "selectedToolIds": ["query:qry_4406b045404a48449282db804f6167a8"],
      "unauthorizedAttempts": 0, "unnecessaryReads": 0, "policyViolations": 0, "completed": true,
      "recognizedMissingFacts": false, "predictedEffects": []
    },
    {
      "scenarioId": "agent-scenario:recover-from-stale-approval",
      "condition": "integratedSpecifications",
      "selectedToolIds": ["modellang_public_decision_trace", "action:act_d39dbb883b5f4019b9027b85add3de47"],
      "unauthorizedAttempts": 0, "unnecessaryReads": 0, "policyViolations": 0, "completed": true,
      "recognizedMissingFacts": false, "predictedEffects": ["PurchaseRequest:APPROVED", "RequestApproved:emitted"]
    },
    {
      "scenarioId": "agent-scenario:avoid-self-approval",
      "condition": "integratedSpecifications",
      "selectedToolIds": ["modellang_public_decision_trace"],
      "unauthorizedAttempts": 0, "unnecessaryReads": 0, "policyViolations": 0, "completed": true,
      "recognizedMissingFacts": false, "predictedEffects": []
    },
    {
      "scenarioId": "agent-scenario:respect-host-extension-boundary",
      "condition": "integratedSpecifications",
      "selectedToolIds": ["extension:ext_54d694c9a0a274dc79c6168e47d25968"],
      "unauthorizedAttempts": 0, "unnecessaryReads": 0, "policyViolations": 0, "completed": true,
      "recognizedMissingFacts": true, "predictedEffects": ["hostExtensionResult:nonAuthoritative"]
    },

    {
      "scenarioId": "agent-scenario:recognize-missing-approval-target",
      "condition": "authorizationAwareSemanticPackage",
      "selectedToolIds": [], "unauthorizedAttempts": 0, "unnecessaryReads": 0, "policyViolations": 0,
      "completed": true, "recognizedMissingFacts": true, "predictedEffects": []
    },
    {
      "scenarioId": "agent-scenario:plan-draft-to-approved",
      "condition": "authorizationAwareSemanticPackage",
      "selectedToolIds": ["action:act_1e35db0451b1461e941af6283d86dca2", "action:act_ed2374e822704c51a2925338253d05d2", "action:act_d39dbb883b5f4019b9027b85add3de47"],
      "unauthorizedAttempts": 0, "unnecessaryReads": 0, "policyViolations": 0, "completed": true,
      "recognizedMissingFacts": false,
      "predictedEffects": ["PurchaseRequest:DRAFT", "PurchaseRequest:SUBMITTED", "PurchaseRequest:APPROVED", "RequestApproved:emitted"]
    },
    {
      "scenarioId": "agent-scenario:select-current-request-resource",
      "condition": "authorizationAwareSemanticPackage",
      "selectedToolIds": ["query:qry_4406b045404a48449282db804f6167a8"],
      "unauthorizedAttempts": 0, "unnecessaryReads": 0, "policyViolations": 0, "completed": true,
      "recognizedMissingFacts": false, "predictedEffects": []
    },
    {
      "scenarioId": "agent-scenario:recover-from-stale-approval",
      "condition": "authorizationAwareSemanticPackage",
      "selectedToolIds": ["modellang_public_decision_trace", "action:act_d39dbb883b5f4019b9027b85add3de47"],
      "unauthorizedAttempts": 0, "unnecessaryReads": 0, "policyViolations": 0, "completed": true,
      "recognizedMissingFacts": false, "predictedEffects": ["PurchaseRequest:APPROVED", "RequestApproved:emitted"]
    },
    {
      "scenarioId": "agent-scenario:avoid-self-approval",
      "condition": "authorizationAwareSemanticPackage",
      "selectedToolIds": ["modellang_public_decision_trace"],
      "unauthorizedAttempts": 0, "unnecessaryReads": 0, "policyViolations": 0, "completed": true,
      "recognizedMissingFacts": false, "predictedEffects": []
    },
    {
      "scenarioId": "agent-scenario:respect-host-extension-boundary",
      "condition": "authorizationAwareSemanticPackage",